rank,uri,artist_names,track_name,source,peak_rank,previous_rank,weeks_on_chart,streams
195,"spotify:track:053zWWZDziDJd3U94x8RuP","Marília Mendonça, Maiara & Maraisa","Todo Mundo Menos Você","Som Livre",2,193,54,"727429"
196,"spotify:track:3JJXjB4TtfJMQSqVl1Ul9y","MC BN, MC Guto VGS, Dj kl do abc","Eu Acho Que Vi um Gatinho","Ritmo dos Fluxos Records",161,199,3,"727030"
197,"spotify:track:62ke5zFUJN6RvtXZgVH0F8","Paloma Faith","Only Love Can Hurt Like This","RCA Records Label",173,188,8,"724211"
198,"spotify:track:7kzFnjDEbftVgf7HL6xf9j","Léo & Raphael, Jorge","Larga AÍ Pra Ver - Ao Vivo","Léo e Raphael",69,197,25,"723224"
199,"spotify:track:7gVzhRCrLRUBEGdS7zNTp0","Zé Felipe","Malvada","Som Livre",2,181,36,"721919"
200,"spotify:track:4GOs8fPjp4M9CBHanTMwsQ","Henrique & Juliano","Seu Perfil - Ao Vivo","Virgin Music Label And Artist Services (S&D)",67,-1,34,"720802"
